{
  "checker_version": "0.4",
  "status": "PASS",
  "errors": [],
  "workflow": {
    "version": "0.4",
    "intent": "paper-benchmark",
    "state": "CHECKERS",
    "history": [
      "INTENT_CLASSIFY",
      "PREFLIGHT_INTAKE",
      "MODEL_CLASSIFY",
      "FORMULA_BINDING",
      "DERIVATION",
      "CHECKERS"
    ],
    "predecessor": {
      "artifact_type": "derivation",
      "state": "DERIVATION",
      "sha256": "188a4e9dddeaf308126d1d1ccb5de174f4afa7dcffc22060c0ed4f67fb14013b"
    },
    "artifact_sha256": "138896cc12b47a5420b1f5813488327a50e83d61af1296a7d62b7381cd22b33e"
  }
}